{"completedStages":["build"],"contractId":"offline-harness-report","declarationDigest":"4c2cad11b9fd3f748278a91238d3151121a50c192e03fd156d6ae0ce156aa472","empiricalModelEvidence":false,"externalModelRequestCount":0,"liveModelValidationAuthorized":false,"result":"pending","runId":"pending","schemaVersion":1,"state":"predeclared"}